{
  "country": "DE",
  "city": "hamburg",
  "source": "aladhan",
  "method": "mwl",
  "madhab": "shafi",
  "year": 2026,
  "month": 7,
  "timezone": "Europe/Berlin",
  "coordinates": {
    "lat": 53.5511,
    "lon": 9.9937
  },
  "days": [
    {
      "date": "2026-07-01",
      "fajr": "02:48",
      "sunrise": "04:55",
      "dhuhr": "13:24",
      "asr": "17:50",
      "maghrib": "21:52",
      "isha": "23:59"
    },
    {
      "date": "2026-07-02",
      "fajr": "02:49",
      "sunrise": "04:56",
      "dhuhr": "13:24",
      "asr": "17:50",
      "maghrib": "21:52",
      "isha": "23:59"
    },
    {
      "date": "2026-07-03",
      "fajr": "02:49",
      "sunrise": "04:57",
      "dhuhr": "13:24",
      "asr": "17:50",
      "maghrib": "21:51",
      "isha": "23:59"
    },
    {
      "date": "2026-07-04",
      "fajr": "02:50",
      "sunrise": "04:58",
      "dhuhr": "13:24",
      "asr": "17:50",
      "maghrib": "21:51",
      "isha": "23:59"
    },
    {
      "date": "2026-07-05",
      "fajr": "02:50",
      "sunrise": "04:59",
      "dhuhr": "13:25",
      "asr": "17:50",
      "maghrib": "21:50",
      "isha": "23:59"
    },
    {
      "date": "2026-07-06",
      "fajr": "02:51",
      "sunrise": "04:59",
      "dhuhr": "13:25",
      "asr": "17:50",
      "maghrib": "21:50",
      "isha": "23:59"
    },
    {
      "date": "2026-07-07",
      "fajr": "02:51",
      "sunrise": "05:00",
      "dhuhr": "13:25",
      "asr": "17:50",
      "maghrib": "21:49",
      "isha": "23:58"
    },
    {
      "date": "2026-07-08",
      "fajr": "02:52",
      "sunrise": "05:02",
      "dhuhr": "13:25",
      "asr": "17:50",
      "maghrib": "21:48",
      "isha": "23:58"
    },
    {
      "date": "2026-07-09",
      "fajr": "02:52",
      "sunrise": "05:03",
      "dhuhr": "13:25",
      "asr": "17:50",
      "maghrib": "21:48",
      "isha": "23:58"
    },
    {
      "date": "2026-07-10",
      "fajr": "02:53",
      "sunrise": "05:04",
      "dhuhr": "13:25",
      "asr": "17:50",
      "maghrib": "21:47",
      "isha": "23:58"
    },
    {
      "date": "2026-07-11",
      "fajr": "02:53",
      "sunrise": "05:05",
      "dhuhr": "13:26",
      "asr": "17:49",
      "maghrib": "21:46",
      "isha": "23:58"
    },
    {
      "date": "2026-07-12",
      "fajr": "02:54",
      "sunrise": "05:06",
      "dhuhr": "13:26",
      "asr": "17:49",
      "maghrib": "21:45",
      "isha": "23:57"
    },
    {
      "date": "2026-07-13",
      "fajr": "02:54",
      "sunrise": "05:07",
      "dhuhr": "13:26",
      "asr": "17:49",
      "maghrib": "21:44",
      "isha": "23:57"
    },
    {
      "date": "2026-07-14",
      "fajr": "02:55",
      "sunrise": "05:08",
      "dhuhr": "13:26",
      "asr": "17:49",
      "maghrib": "21:43",
      "isha": "23:57"
    },
    {
      "date": "2026-07-15",
      "fajr": "02:55",
      "sunrise": "05:10",
      "dhuhr": "13:26",
      "asr": "17:48",
      "maghrib": "21:42",
      "isha": "23:56"
    },
    {
      "date": "2026-07-16",
      "fajr": "02:56",
      "sunrise": "05:11",
      "dhuhr": "13:26",
      "asr": "17:48",
      "maghrib": "21:41",
      "isha": "23:56"
    },
    {
      "date": "2026-07-17",
      "fajr": "02:57",
      "sunrise": "05:12",
      "dhuhr": "13:26",
      "asr": "17:48",
      "maghrib": "21:39",
      "isha": "23:55"
    },
    {
      "date": "2026-07-18",
      "fajr": "02:57",
      "sunrise": "05:14",
      "dhuhr": "13:26",
      "asr": "17:47",
      "maghrib": "21:38",
      "isha": "23:55"
    },
    {
      "date": "2026-07-19",
      "fajr": "02:58",
      "sunrise": "05:15",
      "dhuhr": "13:26",
      "asr": "17:47",
      "maghrib": "21:37",
      "isha": "23:54"
    },
    {
      "date": "2026-07-20",
      "fajr": "02:58",
      "sunrise": "05:17",
      "dhuhr": "13:26",
      "asr": "17:47",
      "maghrib": "21:36",
      "isha": "23:54"
    },
    {
      "date": "2026-07-21",
      "fajr": "02:59",
      "sunrise": "05:18",
      "dhuhr": "13:26",
      "asr": "17:46",
      "maghrib": "21:34",
      "isha": "23:53"
    },
    {
      "date": "2026-07-22",
      "fajr": "03:00",
      "sunrise": "05:20",
      "dhuhr": "13:27",
      "asr": "17:46",
      "maghrib": "21:33",
      "isha": "23:53"
    },
    {
      "date": "2026-07-23",
      "fajr": "03:00",
      "sunrise": "05:21",
      "dhuhr": "13:27",
      "asr": "17:45",
      "maghrib": "21:31",
      "isha": "23:52"
    },
    {
      "date": "2026-07-24",
      "fajr": "03:01",
      "sunrise": "05:23",
      "dhuhr": "13:27",
      "asr": "17:45",
      "maghrib": "21:30",
      "isha": "23:52"
    },
    {
      "date": "2026-07-25",
      "fajr": "03:01",
      "sunrise": "05:24",
      "dhuhr": "13:27",
      "asr": "17:44",
      "maghrib": "21:28",
      "isha": "23:51"
    },
    {
      "date": "2026-07-26",
      "fajr": "03:02",
      "sunrise": "05:26",
      "dhuhr": "13:27",
      "asr": "17:43",
      "maghrib": "21:27",
      "isha": "23:50"
    },
    {
      "date": "2026-07-27",
      "fajr": "03:03",
      "sunrise": "05:27",
      "dhuhr": "13:27",
      "asr": "17:43",
      "maghrib": "21:25",
      "isha": "23:50"
    },
    {
      "date": "2026-07-28",
      "fajr": "03:03",
      "sunrise": "05:29",
      "dhuhr": "13:27",
      "asr": "17:42",
      "maghrib": "21:23",
      "isha": "23:49"
    },
    {
      "date": "2026-07-29",
      "fajr": "03:04",
      "sunrise": "05:30",
      "dhuhr": "13:27",
      "asr": "17:42",
      "maghrib": "21:22",
      "isha": "23:48"
    },
    {
      "date": "2026-07-30",
      "fajr": "03:04",
      "sunrise": "05:32",
      "dhuhr": "13:26",
      "asr": "17:41",
      "maghrib": "21:20",
      "isha": "23:48"
    },
    {
      "date": "2026-07-31",
      "fajr": "03:05",
      "sunrise": "05:34",
      "dhuhr": "13:26",
      "asr": "17:40",
      "maghrib": "21:18",
      "isha": "23:47"
    }
  ]
}