{
  "country": "IN",
  "city": "kolkata",
  "source": "aladhan",
  "method": "karachi",
  "madhab": "hanafi",
  "year": 2026,
  "month": 5,
  "timezone": "Asia/Kolkata",
  "coordinates": {
    "lat": 22.5726,
    "lon": 88.3639
  },
  "days": [
    {
      "date": "2026-05-01",
      "fajr": "03:37",
      "sunrise": "05:04",
      "dhuhr": "11:34",
      "asr": "14:57",
      "maghrib": "18:03",
      "isha": "19:21"
    },
    {
      "date": "2026-05-02",
      "fajr": "03:37",
      "sunrise": "05:04",
      "dhuhr": "11:34",
      "asr": "14:56",
      "maghrib": "18:04",
      "isha": "19:21"
    },
    {
      "date": "2026-05-03",
      "fajr": "03:36",
      "sunrise": "05:03",
      "dhuhr": "11:33",
      "asr": "14:56",
      "maghrib": "18:04",
      "isha": "19:22"
    },
    {
      "date": "2026-05-04",
      "fajr": "03:35",
      "sunrise": "05:02",
      "dhuhr": "11:33",
      "asr": "14:56",
      "maghrib": "18:05",
      "isha": "19:22"
    },
    {
      "date": "2026-05-05",
      "fajr": "03:34",
      "sunrise": "05:02",
      "dhuhr": "11:33",
      "asr": "14:55",
      "maghrib": "18:05",
      "isha": "19:23"
    },
    {
      "date": "2026-05-06",
      "fajr": "03:33",
      "sunrise": "05:01",
      "dhuhr": "11:33",
      "asr": "14:55",
      "maghrib": "18:05",
      "isha": "19:24"
    },
    {
      "date": "2026-05-07",
      "fajr": "03:32",
      "sunrise": "05:01",
      "dhuhr": "11:33",
      "asr": "14:55",
      "maghrib": "18:06",
      "isha": "19:24"
    },
    {
      "date": "2026-05-08",
      "fajr": "03:32",
      "sunrise": "05:00",
      "dhuhr": "11:33",
      "asr": "14:54",
      "maghrib": "18:06",
      "isha": "19:25"
    },
    {
      "date": "2026-05-09",
      "fajr": "03:31",
      "sunrise": "04:59",
      "dhuhr": "11:33",
      "asr": "14:54",
      "maghrib": "18:07",
      "isha": "19:26"
    },
    {
      "date": "2026-05-10",
      "fajr": "03:30",
      "sunrise": "04:59",
      "dhuhr": "11:33",
      "asr": "14:54",
      "maghrib": "18:07",
      "isha": "19:26"
    },
    {
      "date": "2026-05-11",
      "fajr": "03:29",
      "sunrise": "04:58",
      "dhuhr": "11:33",
      "asr": "14:54",
      "maghrib": "18:08",
      "isha": "19:27"
    },
    {
      "date": "2026-05-12",
      "fajr": "03:29",
      "sunrise": "04:58",
      "dhuhr": "11:33",
      "asr": "14:53",
      "maghrib": "18:08",
      "isha": "19:28"
    },
    {
      "date": "2026-05-13",
      "fajr": "03:28",
      "sunrise": "04:57",
      "dhuhr": "11:33",
      "asr": "14:53",
      "maghrib": "18:09",
      "isha": "19:28"
    },
    {
      "date": "2026-05-14",
      "fajr": "03:27",
      "sunrise": "04:57",
      "dhuhr": "11:33",
      "asr": "14:53",
      "maghrib": "18:09",
      "isha": "19:29"
    },
    {
      "date": "2026-05-15",
      "fajr": "03:27",
      "sunrise": "04:56",
      "dhuhr": "11:33",
      "asr": "14:53",
      "maghrib": "18:10",
      "isha": "19:29"
    },
    {
      "date": "2026-05-16",
      "fajr": "03:26",
      "sunrise": "04:56",
      "dhuhr": "11:33",
      "asr": "14:53",
      "maghrib": "18:10",
      "isha": "19:30"
    },
    {
      "date": "2026-05-17",
      "fajr": "03:25",
      "sunrise": "04:56",
      "dhuhr": "11:33",
      "asr": "14:52",
      "maghrib": "18:10",
      "isha": "19:31"
    },
    {
      "date": "2026-05-18",
      "fajr": "03:25",
      "sunrise": "04:55",
      "dhuhr": "11:33",
      "asr": "14:52",
      "maghrib": "18:11",
      "isha": "19:31"
    },
    {
      "date": "2026-05-19",
      "fajr": "03:24",
      "sunrise": "04:55",
      "dhuhr": "11:33",
      "asr": "14:52",
      "maghrib": "18:11",
      "isha": "19:32"
    },
    {
      "date": "2026-05-20",
      "fajr": "03:24",
      "sunrise": "04:54",
      "dhuhr": "11:33",
      "asr": "14:52",
      "maghrib": "18:12",
      "isha": "19:33"
    },
    {
      "date": "2026-05-21",
      "fajr": "03:23",
      "sunrise": "04:54",
      "dhuhr": "11:33",
      "asr": "14:52",
      "maghrib": "18:12",
      "isha": "19:33"
    },
    {
      "date": "2026-05-22",
      "fajr": "03:23",
      "sunrise": "04:54",
      "dhuhr": "11:33",
      "asr": "14:51",
      "maghrib": "18:13",
      "isha": "19:34"
    },
    {
      "date": "2026-05-23",
      "fajr": "03:22",
      "sunrise": "04:54",
      "dhuhr": "11:33",
      "asr": "14:51",
      "maghrib": "18:13",
      "isha": "19:35"
    },
    {
      "date": "2026-05-24",
      "fajr": "03:22",
      "sunrise": "04:53",
      "dhuhr": "11:33",
      "asr": "14:51",
      "maghrib": "18:14",
      "isha": "19:35"
    },
    {
      "date": "2026-05-25",
      "fajr": "03:21",
      "sunrise": "04:53",
      "dhuhr": "11:33",
      "asr": "14:51",
      "maghrib": "18:14",
      "isha": "19:36"
    },
    {
      "date": "2026-05-26",
      "fajr": "03:21",
      "sunrise": "04:53",
      "dhuhr": "11:34",
      "asr": "14:51",
      "maghrib": "18:15",
      "isha": "19:36"
    },
    {
      "date": "2026-05-27",
      "fajr": "03:20",
      "sunrise": "04:53",
      "dhuhr": "11:34",
      "asr": "14:51",
      "maghrib": "18:15",
      "isha": "19:37"
    },
    {
      "date": "2026-05-28",
      "fajr": "03:20",
      "sunrise": "04:52",
      "dhuhr": "11:34",
      "asr": "14:51",
      "maghrib": "18:15",
      "isha": "19:38"
    },
    {
      "date": "2026-05-29",
      "fajr": "03:20",
      "sunrise": "04:52",
      "dhuhr": "11:34",
      "asr": "14:51",
      "maghrib": "18:16",
      "isha": "19:38"
    },
    {
      "date": "2026-05-30",
      "fajr": "03:19",
      "sunrise": "04:52",
      "dhuhr": "11:34",
      "asr": "14:51",
      "maghrib": "18:16",
      "isha": "19:39"
    },
    {
      "date": "2026-05-31",
      "fajr": "03:19",
      "sunrise": "04:52",
      "dhuhr": "11:34",
      "asr": "14:51",
      "maghrib": "18:17",
      "isha": "19:39"
    }
  ]
}