{
  "country": "EG",
  "city": "giza",
  "source": "aladhan",
  "method": "egypt",
  "madhab": "shafi",
  "year": 2026,
  "month": 2,
  "timezone": "Africa/Cairo",
  "coordinates": {
    "lat": 30.0131,
    "lon": 31.2089
  },
  "days": [
    {
      "date": "2026-02-01",
      "fajr": "05:24",
      "sunrise": "06:46",
      "dhuhr": "12:09",
      "asr": "15:10",
      "maghrib": "17:32",
      "isha": "18:49"
    },
    {
      "date": "2026-02-02",
      "fajr": "05:23",
      "sunrise": "06:45",
      "dhuhr": "12:09",
      "asr": "15:11",
      "maghrib": "17:33",
      "isha": "18:50"
    },
    {
      "date": "2026-02-03",
      "fajr": "05:23",
      "sunrise": "06:44",
      "dhuhr": "12:09",
      "asr": "15:11",
      "maghrib": "17:34",
      "isha": "18:51"
    },
    {
      "date": "2026-02-04",
      "fajr": "05:22",
      "sunrise": "06:44",
      "dhuhr": "12:09",
      "asr": "15:12",
      "maghrib": "17:35",
      "isha": "18:52"
    },
    {
      "date": "2026-02-05",
      "fajr": "05:22",
      "sunrise": "06:43",
      "dhuhr": "12:09",
      "asr": "15:12",
      "maghrib": "17:36",
      "isha": "18:52"
    },
    {
      "date": "2026-02-06",
      "fajr": "05:21",
      "sunrise": "06:42",
      "dhuhr": "12:09",
      "asr": "15:13",
      "maghrib": "17:36",
      "isha": "18:53"
    },
    {
      "date": "2026-02-07",
      "fajr": "05:20",
      "sunrise": "06:42",
      "dhuhr": "12:09",
      "asr": "15:14",
      "maghrib": "17:37",
      "isha": "18:54"
    },
    {
      "date": "2026-02-08",
      "fajr": "05:20",
      "sunrise": "06:41",
      "dhuhr": "12:09",
      "asr": "15:14",
      "maghrib": "17:38",
      "isha": "18:55"
    },
    {
      "date": "2026-02-09",
      "fajr": "05:19",
      "sunrise": "06:40",
      "dhuhr": "12:09",
      "asr": "15:15",
      "maghrib": "17:39",
      "isha": "18:55"
    },
    {
      "date": "2026-02-10",
      "fajr": "05:18",
      "sunrise": "06:39",
      "dhuhr": "12:09",
      "asr": "15:16",
      "maghrib": "17:40",
      "isha": "18:56"
    },
    {
      "date": "2026-02-11",
      "fajr": "05:18",
      "sunrise": "06:39",
      "dhuhr": "12:09",
      "asr": "15:16",
      "maghrib": "17:41",
      "isha": "18:57"
    },
    {
      "date": "2026-02-12",
      "fajr": "05:17",
      "sunrise": "06:38",
      "dhuhr": "12:09",
      "asr": "15:17",
      "maghrib": "17:41",
      "isha": "18:57"
    },
    {
      "date": "2026-02-13",
      "fajr": "05:16",
      "sunrise": "06:37",
      "dhuhr": "12:09",
      "asr": "15:17",
      "maghrib": "17:42",
      "isha": "18:58"
    },
    {
      "date": "2026-02-14",
      "fajr": "05:16",
      "sunrise": "06:36",
      "dhuhr": "12:09",
      "asr": "15:18",
      "maghrib": "17:43",
      "isha": "18:59"
    },
    {
      "date": "2026-02-15",
      "fajr": "05:15",
      "sunrise": "06:35",
      "dhuhr": "12:09",
      "asr": "15:18",
      "maghrib": "17:44",
      "isha": "19:00"
    },
    {
      "date": "2026-02-16",
      "fajr": "05:14",
      "sunrise": "06:34",
      "dhuhr": "12:09",
      "asr": "15:19",
      "maghrib": "17:45",
      "isha": "19:00"
    },
    {
      "date": "2026-02-17",
      "fajr": "05:13",
      "sunrise": "06:33",
      "dhuhr": "12:09",
      "asr": "15:20",
      "maghrib": "17:45",
      "isha": "19:01"
    },
    {
      "date": "2026-02-18",
      "fajr": "05:12",
      "sunrise": "06:32",
      "dhuhr": "12:09",
      "asr": "15:20",
      "maghrib": "17:46",
      "isha": "19:02"
    },
    {
      "date": "2026-02-19",
      "fajr": "05:11",
      "sunrise": "06:32",
      "dhuhr": "12:09",
      "asr": "15:20",
      "maghrib": "17:47",
      "isha": "19:02"
    },
    {
      "date": "2026-02-20",
      "fajr": "05:11",
      "sunrise": "06:31",
      "dhuhr": "12:09",
      "asr": "15:21",
      "maghrib": "17:48",
      "isha": "19:03"
    },
    {
      "date": "2026-02-21",
      "fajr": "05:10",
      "sunrise": "06:30",
      "dhuhr": "12:09",
      "asr": "15:21",
      "maghrib": "17:48",
      "isha": "19:04"
    },
    {
      "date": "2026-02-22",
      "fajr": "05:09",
      "sunrise": "06:29",
      "dhuhr": "12:09",
      "asr": "15:22",
      "maghrib": "17:49",
      "isha": "19:04"
    },
    {
      "date": "2026-02-23",
      "fajr": "05:08",
      "sunrise": "06:28",
      "dhuhr": "12:08",
      "asr": "15:22",
      "maghrib": "17:50",
      "isha": "19:05"
    },
    {
      "date": "2026-02-24",
      "fajr": "05:07",
      "sunrise": "06:27",
      "dhuhr": "12:08",
      "asr": "15:23",
      "maghrib": "17:51",
      "isha": "19:06"
    },
    {
      "date": "2026-02-25",
      "fajr": "05:06",
      "sunrise": "06:26",
      "dhuhr": "12:08",
      "asr": "15:23",
      "maghrib": "17:51",
      "isha": "19:06"
    },
    {
      "date": "2026-02-26",
      "fajr": "05:05",
      "sunrise": "06:25",
      "dhuhr": "12:08",
      "asr": "15:24",
      "maghrib": "17:52",
      "isha": "19:07"
    },
    {
      "date": "2026-02-27",
      "fajr": "05:04",
      "sunrise": "06:23",
      "dhuhr": "12:08",
      "asr": "15:24",
      "maghrib": "17:53",
      "isha": "19:08"
    },
    {
      "date": "2026-02-28",
      "fajr": "05:03",
      "sunrise": "06:22",
      "dhuhr": "12:08",
      "asr": "15:24",
      "maghrib": "17:53",
      "isha": "19:08"
    }
  ]
}