{
  "country": "DJ",
  "city": "djibouti",
  "source": "aladhan",
  "method": "mwl",
  "madhab": "shafi",
  "year": 2026,
  "month": 4,
  "timezone": "Africa/Djibouti",
  "coordinates": {
    "lat": 11.5721,
    "lon": 43.1456
  },
  "days": [
    {
      "date": "2026-04-01",
      "fajr": "04:54",
      "sunrise": "06:04",
      "dhuhr": "12:11",
      "asr": "15:24",
      "maghrib": "18:19",
      "isha": "19:29"
    },
    {
      "date": "2026-04-02",
      "fajr": "04:53",
      "sunrise": "06:04",
      "dhuhr": "12:11",
      "asr": "15:23",
      "maghrib": "18:19",
      "isha": "19:29"
    },
    {
      "date": "2026-04-03",
      "fajr": "04:52",
      "sunrise": "06:03",
      "dhuhr": "12:11",
      "asr": "15:22",
      "maghrib": "18:19",
      "isha": "19:29"
    },
    {
      "date": "2026-04-04",
      "fajr": "04:52",
      "sunrise": "06:02",
      "dhuhr": "12:10",
      "asr": "15:22",
      "maghrib": "18:19",
      "isha": "19:29"
    },
    {
      "date": "2026-04-05",
      "fajr": "04:51",
      "sunrise": "06:02",
      "dhuhr": "12:10",
      "asr": "15:21",
      "maghrib": "18:19",
      "isha": "19:30"
    },
    {
      "date": "2026-04-06",
      "fajr": "04:50",
      "sunrise": "06:01",
      "dhuhr": "12:10",
      "asr": "15:20",
      "maghrib": "18:19",
      "isha": "19:30"
    },
    {
      "date": "2026-04-07",
      "fajr": "04:50",
      "sunrise": "06:01",
      "dhuhr": "12:10",
      "asr": "15:20",
      "maghrib": "18:19",
      "isha": "19:30"
    },
    {
      "date": "2026-04-08",
      "fajr": "04:49",
      "sunrise": "06:00",
      "dhuhr": "12:09",
      "asr": "15:19",
      "maghrib": "18:19",
      "isha": "19:30"
    },
    {
      "date": "2026-04-09",
      "fajr": "04:48",
      "sunrise": "05:59",
      "dhuhr": "12:09",
      "asr": "15:18",
      "maghrib": "18:19",
      "isha": "19:30"
    },
    {
      "date": "2026-04-10",
      "fajr": "04:48",
      "sunrise": "05:59",
      "dhuhr": "12:09",
      "asr": "15:17",
      "maghrib": "18:19",
      "isha": "19:30"
    },
    {
      "date": "2026-04-11",
      "fajr": "04:47",
      "sunrise": "05:58",
      "dhuhr": "12:08",
      "asr": "15:17",
      "maghrib": "18:19",
      "isha": "19:30"
    },
    {
      "date": "2026-04-12",
      "fajr": "04:46",
      "sunrise": "05:58",
      "dhuhr": "12:08",
      "asr": "15:16",
      "maghrib": "18:19",
      "isha": "19:30"
    },
    {
      "date": "2026-04-13",
      "fajr": "04:46",
      "sunrise": "05:57",
      "dhuhr": "12:08",
      "asr": "15:15",
      "maghrib": "18:19",
      "isha": "19:31"
    },
    {
      "date": "2026-04-14",
      "fajr": "04:45",
      "sunrise": "05:57",
      "dhuhr": "12:08",
      "asr": "15:14",
      "maghrib": "18:19",
      "isha": "19:31"
    },
    {
      "date": "2026-04-15",
      "fajr": "04:44",
      "sunrise": "05:56",
      "dhuhr": "12:07",
      "asr": "15:13",
      "maghrib": "18:19",
      "isha": "19:31"
    },
    {
      "date": "2026-04-16",
      "fajr": "04:44",
      "sunrise": "05:55",
      "dhuhr": "12:07",
      "asr": "15:13",
      "maghrib": "18:19",
      "isha": "19:31"
    },
    {
      "date": "2026-04-17",
      "fajr": "04:43",
      "sunrise": "05:55",
      "dhuhr": "12:07",
      "asr": "15:12",
      "maghrib": "18:19",
      "isha": "19:31"
    },
    {
      "date": "2026-04-18",
      "fajr": "04:42",
      "sunrise": "05:54",
      "dhuhr": "12:07",
      "asr": "15:11",
      "maghrib": "18:19",
      "isha": "19:31"
    },
    {
      "date": "2026-04-19",
      "fajr": "04:42",
      "sunrise": "05:54",
      "dhuhr": "12:07",
      "asr": "15:10",
      "maghrib": "18:19",
      "isha": "19:32"
    },
    {
      "date": "2026-04-20",
      "fajr": "04:41",
      "sunrise": "05:53",
      "dhuhr": "12:06",
      "asr": "15:11",
      "maghrib": "18:19",
      "isha": "19:32"
    },
    {
      "date": "2026-04-21",
      "fajr": "04:41",
      "sunrise": "05:53",
      "dhuhr": "12:06",
      "asr": "15:12",
      "maghrib": "18:20",
      "isha": "19:32"
    },
    {
      "date": "2026-04-22",
      "fajr": "04:40",
      "sunrise": "05:52",
      "dhuhr": "12:06",
      "asr": "15:12",
      "maghrib": "18:20",
      "isha": "19:32"
    },
    {
      "date": "2026-04-23",
      "fajr": "04:39",
      "sunrise": "05:52",
      "dhuhr": "12:06",
      "asr": "15:13",
      "maghrib": "18:20",
      "isha": "19:32"
    },
    {
      "date": "2026-04-24",
      "fajr": "04:39",
      "sunrise": "05:51",
      "dhuhr": "12:06",
      "asr": "15:13",
      "maghrib": "18:20",
      "isha": "19:33"
    },
    {
      "date": "2026-04-25",
      "fajr": "04:38",
      "sunrise": "05:51",
      "dhuhr": "12:05",
      "asr": "15:14",
      "maghrib": "18:20",
      "isha": "19:33"
    },
    {
      "date": "2026-04-26",
      "fajr": "04:38",
      "sunrise": "05:51",
      "dhuhr": "12:05",
      "asr": "15:14",
      "maghrib": "18:20",
      "isha": "19:33"
    },
    {
      "date": "2026-04-27",
      "fajr": "04:37",
      "sunrise": "05:50",
      "dhuhr": "12:05",
      "asr": "15:15",
      "maghrib": "18:20",
      "isha": "19:33"
    },
    {
      "date": "2026-04-28",
      "fajr": "04:36",
      "sunrise": "05:50",
      "dhuhr": "12:05",
      "asr": "15:16",
      "maghrib": "18:20",
      "isha": "19:34"
    },
    {
      "date": "2026-04-29",
      "fajr": "04:36",
      "sunrise": "05:49",
      "dhuhr": "12:05",
      "asr": "15:16",
      "maghrib": "18:21",
      "isha": "19:34"
    },
    {
      "date": "2026-04-30",
      "fajr": "04:35",
      "sunrise": "05:49",
      "dhuhr": "12:05",
      "asr": "15:17",
      "maghrib": "18:21",
      "isha": "19:34"
    }
  ]
}