{
  "country": "NG",
  "city": "kano",
  "source": "aladhan",
  "method": "mwl",
  "madhab": "shafi",
  "year": 2026,
  "month": 7,
  "timezone": "Africa/Lagos",
  "coordinates": {
    "lat": 12.0022,
    "lon": 8.592
  },
  "days": [
    {
      "date": "2026-07-01",
      "fajr": "04:47",
      "sunrise": "06:05",
      "dhuhr": "12:30",
      "asr": "15:55",
      "maghrib": "18:54",
      "isha": "20:12"
    },
    {
      "date": "2026-07-02",
      "fajr": "04:47",
      "sunrise": "06:05",
      "dhuhr": "12:30",
      "asr": "15:56",
      "maghrib": "18:54",
      "isha": "20:13"
    },
    {
      "date": "2026-07-03",
      "fajr": "04:47",
      "sunrise": "06:05",
      "dhuhr": "12:30",
      "asr": "15:56",
      "maghrib": "18:54",
      "isha": "20:13"
    },
    {
      "date": "2026-07-04",
      "fajr": "04:48",
      "sunrise": "06:06",
      "dhuhr": "12:30",
      "asr": "15:56",
      "maghrib": "18:54",
      "isha": "20:13"
    },
    {
      "date": "2026-07-05",
      "fajr": "04:48",
      "sunrise": "06:06",
      "dhuhr": "12:30",
      "asr": "15:56",
      "maghrib": "18:54",
      "isha": "20:13"
    },
    {
      "date": "2026-07-06",
      "fajr": "04:48",
      "sunrise": "06:06",
      "dhuhr": "12:30",
      "asr": "15:56",
      "maghrib": "18:55",
      "isha": "20:13"
    },
    {
      "date": "2026-07-07",
      "fajr": "04:49",
      "sunrise": "06:07",
      "dhuhr": "12:31",
      "asr": "15:56",
      "maghrib": "18:55",
      "isha": "20:13"
    },
    {
      "date": "2026-07-08",
      "fajr": "04:49",
      "sunrise": "06:07",
      "dhuhr": "12:31",
      "asr": "15:56",
      "maghrib": "18:55",
      "isha": "20:13"
    },
    {
      "date": "2026-07-09",
      "fajr": "04:49",
      "sunrise": "06:07",
      "dhuhr": "12:31",
      "asr": "15:56",
      "maghrib": "18:55",
      "isha": "20:12"
    },
    {
      "date": "2026-07-10",
      "fajr": "04:50",
      "sunrise": "06:07",
      "dhuhr": "12:31",
      "asr": "15:55",
      "maghrib": "18:55",
      "isha": "20:12"
    },
    {
      "date": "2026-07-11",
      "fajr": "04:50",
      "sunrise": "06:08",
      "dhuhr": "12:31",
      "asr": "15:55",
      "maghrib": "18:55",
      "isha": "20:12"
    },
    {
      "date": "2026-07-12",
      "fajr": "04:50",
      "sunrise": "06:08",
      "dhuhr": "12:31",
      "asr": "15:55",
      "maghrib": "18:55",
      "isha": "20:12"
    },
    {
      "date": "2026-07-13",
      "fajr": "04:51",
      "sunrise": "06:08",
      "dhuhr": "12:31",
      "asr": "15:55",
      "maghrib": "18:55",
      "isha": "20:12"
    },
    {
      "date": "2026-07-14",
      "fajr": "04:51",
      "sunrise": "06:08",
      "dhuhr": "12:32",
      "asr": "15:55",
      "maghrib": "18:55",
      "isha": "20:12"
    },
    {
      "date": "2026-07-15",
      "fajr": "04:51",
      "sunrise": "06:09",
      "dhuhr": "12:32",
      "asr": "15:55",
      "maghrib": "18:54",
      "isha": "20:12"
    },
    {
      "date": "2026-07-16",
      "fajr": "04:52",
      "sunrise": "06:09",
      "dhuhr": "12:32",
      "asr": "15:55",
      "maghrib": "18:54",
      "isha": "20:12"
    },
    {
      "date": "2026-07-17",
      "fajr": "04:52",
      "sunrise": "06:09",
      "dhuhr": "12:32",
      "asr": "15:54",
      "maghrib": "18:54",
      "isha": "20:11"
    },
    {
      "date": "2026-07-18",
      "fajr": "04:53",
      "sunrise": "06:09",
      "dhuhr": "12:32",
      "asr": "15:54",
      "maghrib": "18:54",
      "isha": "20:11"
    },
    {
      "date": "2026-07-19",
      "fajr": "04:53",
      "sunrise": "06:10",
      "dhuhr": "12:32",
      "asr": "15:54",
      "maghrib": "18:54",
      "isha": "20:11"
    },
    {
      "date": "2026-07-20",
      "fajr": "04:53",
      "sunrise": "06:10",
      "dhuhr": "12:32",
      "asr": "15:54",
      "maghrib": "18:54",
      "isha": "20:11"
    },
    {
      "date": "2026-07-21",
      "fajr": "04:54",
      "sunrise": "06:10",
      "dhuhr": "12:32",
      "asr": "15:53",
      "maghrib": "18:54",
      "isha": "20:10"
    },
    {
      "date": "2026-07-22",
      "fajr": "04:54",
      "sunrise": "06:10",
      "dhuhr": "12:32",
      "asr": "15:53",
      "maghrib": "18:54",
      "isha": "20:10"
    },
    {
      "date": "2026-07-23",
      "fajr": "04:54",
      "sunrise": "06:11",
      "dhuhr": "12:32",
      "asr": "15:53",
      "maghrib": "18:54",
      "isha": "20:10"
    },
    {
      "date": "2026-07-24",
      "fajr": "04:55",
      "sunrise": "06:11",
      "dhuhr": "12:32",
      "asr": "15:52",
      "maghrib": "18:53",
      "isha": "20:10"
    },
    {
      "date": "2026-07-25",
      "fajr": "04:55",
      "sunrise": "06:11",
      "dhuhr": "12:32",
      "asr": "15:52",
      "maghrib": "18:53",
      "isha": "20:09"
    },
    {
      "date": "2026-07-26",
      "fajr": "04:55",
      "sunrise": "06:11",
      "dhuhr": "12:32",
      "asr": "15:52",
      "maghrib": "18:53",
      "isha": "20:09"
    },
    {
      "date": "2026-07-27",
      "fajr": "04:56",
      "sunrise": "06:12",
      "dhuhr": "12:32",
      "asr": "15:51",
      "maghrib": "18:53",
      "isha": "20:08"
    },
    {
      "date": "2026-07-28",
      "fajr": "04:56",
      "sunrise": "06:12",
      "dhuhr": "12:32",
      "asr": "15:51",
      "maghrib": "18:52",
      "isha": "20:08"
    },
    {
      "date": "2026-07-29",
      "fajr": "04:56",
      "sunrise": "06:12",
      "dhuhr": "12:32",
      "asr": "15:50",
      "maghrib": "18:52",
      "isha": "20:08"
    },
    {
      "date": "2026-07-30",
      "fajr": "04:57",
      "sunrise": "06:12",
      "dhuhr": "12:32",
      "asr": "15:50",
      "maghrib": "18:52",
      "isha": "20:07"
    },
    {
      "date": "2026-07-31",
      "fajr": "04:57",
      "sunrise": "06:12",
      "dhuhr": "12:32",
      "asr": "15:49",
      "maghrib": "18:52",
      "isha": "20:07"
    }
  ]
}