{
  "country": "BD",
  "city": "khulna",
  "source": "aladhan",
  "method": "karachi",
  "madhab": "hanafi",
  "year": 2026,
  "month": 3,
  "timezone": "Asia/Dhaka",
  "coordinates": {
    "lat": 22.8456,
    "lon": 89.5403
  },
  "days": [
    {
      "date": "2026-03-01",
      "fajr": "05:02",
      "sunrise": "06:24",
      "dhuhr": "12:14",
      "asr": "15:34",
      "maghrib": "18:05",
      "isha": "19:18"
    },
    {
      "date": "2026-03-02",
      "fajr": "05:02",
      "sunrise": "06:23",
      "dhuhr": "12:14",
      "asr": "15:34",
      "maghrib": "18:06",
      "isha": "19:18"
    },
    {
      "date": "2026-03-03",
      "fajr": "05:01",
      "sunrise": "06:22",
      "dhuhr": "12:14",
      "asr": "15:35",
      "maghrib": "18:06",
      "isha": "19:19"
    },
    {
      "date": "2026-03-04",
      "fajr": "05:00",
      "sunrise": "06:21",
      "dhuhr": "12:14",
      "asr": "15:35",
      "maghrib": "18:06",
      "isha": "19:19"
    },
    {
      "date": "2026-03-05",
      "fajr": "04:59",
      "sunrise": "06:20",
      "dhuhr": "12:13",
      "asr": "15:35",
      "maghrib": "18:07",
      "isha": "19:19"
    },
    {
      "date": "2026-03-06",
      "fajr": "04:58",
      "sunrise": "06:19",
      "dhuhr": "12:13",
      "asr": "15:35",
      "maghrib": "18:07",
      "isha": "19:20"
    },
    {
      "date": "2026-03-07",
      "fajr": "04:57",
      "sunrise": "06:18",
      "dhuhr": "12:13",
      "asr": "15:35",
      "maghrib": "18:08",
      "isha": "19:20"
    },
    {
      "date": "2026-03-08",
      "fajr": "04:56",
      "sunrise": "06:17",
      "dhuhr": "12:13",
      "asr": "15:35",
      "maghrib": "18:08",
      "isha": "19:21"
    },
    {
      "date": "2026-03-09",
      "fajr": "04:56",
      "sunrise": "06:17",
      "dhuhr": "12:12",
      "asr": "15:35",
      "maghrib": "18:09",
      "isha": "19:21"
    },
    {
      "date": "2026-03-10",
      "fajr": "04:55",
      "sunrise": "06:16",
      "dhuhr": "12:12",
      "asr": "15:35",
      "maghrib": "18:09",
      "isha": "19:21"
    },
    {
      "date": "2026-03-11",
      "fajr": "04:54",
      "sunrise": "06:15",
      "dhuhr": "12:12",
      "asr": "15:35",
      "maghrib": "18:09",
      "isha": "19:22"
    },
    {
      "date": "2026-03-12",
      "fajr": "04:53",
      "sunrise": "06:14",
      "dhuhr": "12:12",
      "asr": "15:35",
      "maghrib": "18:10",
      "isha": "19:22"
    },
    {
      "date": "2026-03-13",
      "fajr": "04:52",
      "sunrise": "06:13",
      "dhuhr": "12:11",
      "asr": "15:35",
      "maghrib": "18:10",
      "isha": "19:23"
    },
    {
      "date": "2026-03-14",
      "fajr": "04:51",
      "sunrise": "06:12",
      "dhuhr": "12:11",
      "asr": "15:35",
      "maghrib": "18:11",
      "isha": "19:23"
    },
    {
      "date": "2026-03-15",
      "fajr": "04:50",
      "sunrise": "06:11",
      "dhuhr": "12:11",
      "asr": "15:35",
      "maghrib": "18:11",
      "isha": "19:23"
    },
    {
      "date": "2026-03-16",
      "fajr": "04:49",
      "sunrise": "06:10",
      "dhuhr": "12:11",
      "asr": "15:34",
      "maghrib": "18:11",
      "isha": "19:24"
    },
    {
      "date": "2026-03-17",
      "fajr": "04:48",
      "sunrise": "06:09",
      "dhuhr": "12:10",
      "asr": "15:34",
      "maghrib": "18:12",
      "isha": "19:24"
    },
    {
      "date": "2026-03-18",
      "fajr": "04:47",
      "sunrise": "06:08",
      "dhuhr": "12:10",
      "asr": "15:34",
      "maghrib": "18:12",
      "isha": "19:25"
    },
    {
      "date": "2026-03-19",
      "fajr": "04:46",
      "sunrise": "06:07",
      "dhuhr": "12:10",
      "asr": "15:34",
      "maghrib": "18:12",
      "isha": "19:25"
    },
    {
      "date": "2026-03-20",
      "fajr": "04:45",
      "sunrise": "06:06",
      "dhuhr": "12:09",
      "asr": "15:34",
      "maghrib": "18:13",
      "isha": "19:25"
    },
    {
      "date": "2026-03-21",
      "fajr": "04:44",
      "sunrise": "06:05",
      "dhuhr": "12:09",
      "asr": "15:34",
      "maghrib": "18:13",
      "isha": "19:26"
    },
    {
      "date": "2026-03-22",
      "fajr": "04:43",
      "sunrise": "06:04",
      "dhuhr": "12:09",
      "asr": "15:34",
      "maghrib": "18:14",
      "isha": "19:26"
    },
    {
      "date": "2026-03-23",
      "fajr": "04:42",
      "sunrise": "06:03",
      "dhuhr": "12:08",
      "asr": "15:33",
      "maghrib": "18:14",
      "isha": "19:27"
    },
    {
      "date": "2026-03-24",
      "fajr": "04:41",
      "sunrise": "06:02",
      "dhuhr": "12:08",
      "asr": "15:33",
      "maghrib": "18:14",
      "isha": "19:27"
    },
    {
      "date": "2026-03-25",
      "fajr": "04:40",
      "sunrise": "06:01",
      "dhuhr": "12:08",
      "asr": "15:33",
      "maghrib": "18:15",
      "isha": "19:27"
    },
    {
      "date": "2026-03-26",
      "fajr": "04:39",
      "sunrise": "06:00",
      "dhuhr": "12:08",
      "asr": "15:33",
      "maghrib": "18:15",
      "isha": "19:28"
    },
    {
      "date": "2026-03-27",
      "fajr": "04:38",
      "sunrise": "05:59",
      "dhuhr": "12:07",
      "asr": "15:33",
      "maghrib": "18:15",
      "isha": "19:28"
    },
    {
      "date": "2026-03-28",
      "fajr": "04:37",
      "sunrise": "05:59",
      "dhuhr": "12:07",
      "asr": "15:33",
      "maghrib": "18:16",
      "isha": "19:29"
    },
    {
      "date": "2026-03-29",
      "fajr": "04:36",
      "sunrise": "05:58",
      "dhuhr": "12:07",
      "asr": "15:32",
      "maghrib": "18:16",
      "isha": "19:29"
    },
    {
      "date": "2026-03-30",
      "fajr": "04:35",
      "sunrise": "05:57",
      "dhuhr": "12:06",
      "asr": "15:32",
      "maghrib": "18:16",
      "isha": "19:30"
    },
    {
      "date": "2026-03-31",
      "fajr": "04:34",
      "sunrise": "05:56",
      "dhuhr": "12:06",
      "asr": "15:32",
      "maghrib": "18:17",
      "isha": "19:30"
    }
  ]
}