{
  "country": "TD",
  "city": "ndjamena",
  "source": "aladhan",
  "method": "mwl",
  "madhab": "shafi",
  "year": 2026,
  "month": 10,
  "timezone": "Africa/Ndjamena",
  "coordinates": {
    "lat": 12.1348,
    "lon": 15.0557
  },
  "days": [
    {
      "date": "2026-10-01",
      "fajr": "04:39",
      "sunrise": "05:49",
      "dhuhr": "11:49",
      "asr": "15:10",
      "maghrib": "17:50",
      "isha": "19:00"
    },
    {
      "date": "2026-10-02",
      "fajr": "04:39",
      "sunrise": "05:49",
      "dhuhr": "11:49",
      "asr": "15:09",
      "maghrib": "17:49",
      "isha": "18:59"
    },
    {
      "date": "2026-10-03",
      "fajr": "04:39",
      "sunrise": "05:49",
      "dhuhr": "11:49",
      "asr": "15:09",
      "maghrib": "17:49",
      "isha": "18:59"
    },
    {
      "date": "2026-10-04",
      "fajr": "04:39",
      "sunrise": "05:49",
      "dhuhr": "11:48",
      "asr": "15:09",
      "maghrib": "17:48",
      "isha": "18:58"
    },
    {
      "date": "2026-10-05",
      "fajr": "04:39",
      "sunrise": "05:49",
      "dhuhr": "11:48",
      "asr": "15:09",
      "maghrib": "17:47",
      "isha": "18:58"
    },
    {
      "date": "2026-10-06",
      "fajr": "04:39",
      "sunrise": "05:49",
      "dhuhr": "11:48",
      "asr": "15:09",
      "maghrib": "17:47",
      "isha": "18:57"
    },
    {
      "date": "2026-10-07",
      "fajr": "04:39",
      "sunrise": "05:49",
      "dhuhr": "11:48",
      "asr": "15:09",
      "maghrib": "17:46",
      "isha": "18:56"
    },
    {
      "date": "2026-10-08",
      "fajr": "04:39",
      "sunrise": "05:49",
      "dhuhr": "11:47",
      "asr": "15:08",
      "maghrib": "17:45",
      "isha": "18:56"
    },
    {
      "date": "2026-10-09",
      "fajr": "04:39",
      "sunrise": "05:49",
      "dhuhr": "11:47",
      "asr": "15:08",
      "maghrib": "17:45",
      "isha": "18:55"
    },
    {
      "date": "2026-10-10",
      "fajr": "04:39",
      "sunrise": "05:49",
      "dhuhr": "11:47",
      "asr": "15:08",
      "maghrib": "17:44",
      "isha": "18:55"
    },
    {
      "date": "2026-10-11",
      "fajr": "04:39",
      "sunrise": "05:49",
      "dhuhr": "11:47",
      "asr": "15:08",
      "maghrib": "17:44",
      "isha": "18:54"
    },
    {
      "date": "2026-10-12",
      "fajr": "04:39",
      "sunrise": "05:49",
      "dhuhr": "11:46",
      "asr": "15:08",
      "maghrib": "17:43",
      "isha": "18:54"
    },
    {
      "date": "2026-10-13",
      "fajr": "04:39",
      "sunrise": "05:49",
      "dhuhr": "11:46",
      "asr": "15:07",
      "maghrib": "17:43",
      "isha": "18:53"
    },
    {
      "date": "2026-10-14",
      "fajr": "04:39",
      "sunrise": "05:49",
      "dhuhr": "11:46",
      "asr": "15:07",
      "maghrib": "17:42",
      "isha": "18:53"
    },
    {
      "date": "2026-10-15",
      "fajr": "04:39",
      "sunrise": "05:50",
      "dhuhr": "11:46",
      "asr": "15:07",
      "maghrib": "17:41",
      "isha": "18:52"
    },
    {
      "date": "2026-10-16",
      "fajr": "04:39",
      "sunrise": "05:50",
      "dhuhr": "11:45",
      "asr": "15:07",
      "maghrib": "17:41",
      "isha": "18:52"
    },
    {
      "date": "2026-10-17",
      "fajr": "04:39",
      "sunrise": "05:50",
      "dhuhr": "11:45",
      "asr": "15:07",
      "maghrib": "17:40",
      "isha": "18:51"
    },
    {
      "date": "2026-10-18",
      "fajr": "04:39",
      "sunrise": "05:50",
      "dhuhr": "11:45",
      "asr": "15:06",
      "maghrib": "17:40",
      "isha": "18:51"
    },
    {
      "date": "2026-10-19",
      "fajr": "04:39",
      "sunrise": "05:50",
      "dhuhr": "11:45",
      "asr": "15:06",
      "maghrib": "17:39",
      "isha": "18:50"
    },
    {
      "date": "2026-10-20",
      "fajr": "04:39",
      "sunrise": "05:50",
      "dhuhr": "11:45",
      "asr": "15:06",
      "maghrib": "17:39",
      "isha": "18:50"
    },
    {
      "date": "2026-10-21",
      "fajr": "04:39",
      "sunrise": "05:50",
      "dhuhr": "11:44",
      "asr": "15:06",
      "maghrib": "17:38",
      "isha": "18:50"
    },
    {
      "date": "2026-10-22",
      "fajr": "04:39",
      "sunrise": "05:50",
      "dhuhr": "11:44",
      "asr": "15:06",
      "maghrib": "17:38",
      "isha": "18:49"
    },
    {
      "date": "2026-10-23",
      "fajr": "04:39",
      "sunrise": "05:51",
      "dhuhr": "11:44",
      "asr": "15:06",
      "maghrib": "17:37",
      "isha": "18:49"
    },
    {
      "date": "2026-10-24",
      "fajr": "04:39",
      "sunrise": "05:51",
      "dhuhr": "11:44",
      "asr": "15:05",
      "maghrib": "17:37",
      "isha": "18:48"
    },
    {
      "date": "2026-10-25",
      "fajr": "04:40",
      "sunrise": "05:51",
      "dhuhr": "11:44",
      "asr": "15:05",
      "maghrib": "17:37",
      "isha": "18:48"
    },
    {
      "date": "2026-10-26",
      "fajr": "04:40",
      "sunrise": "05:51",
      "dhuhr": "11:44",
      "asr": "15:05",
      "maghrib": "17:36",
      "isha": "18:48"
    },
    {
      "date": "2026-10-27",
      "fajr": "04:40",
      "sunrise": "05:51",
      "dhuhr": "11:44",
      "asr": "15:05",
      "maghrib": "17:36",
      "isha": "18:47"
    },
    {
      "date": "2026-10-28",
      "fajr": "04:40",
      "sunrise": "05:52",
      "dhuhr": "11:44",
      "asr": "15:05",
      "maghrib": "17:35",
      "isha": "18:47"
    },
    {
      "date": "2026-10-29",
      "fajr": "04:40",
      "sunrise": "05:52",
      "dhuhr": "11:43",
      "asr": "15:05",
      "maghrib": "17:35",
      "isha": "18:47"
    },
    {
      "date": "2026-10-30",
      "fajr": "04:40",
      "sunrise": "05:52",
      "dhuhr": "11:43",
      "asr": "15:05",
      "maghrib": "17:35",
      "isha": "18:47"
    },
    {
      "date": "2026-10-31",
      "fajr": "04:40",
      "sunrise": "05:52",
      "dhuhr": "11:43",
      "asr": "15:04",
      "maghrib": "17:34",
      "isha": "18:46"
    }
  ]
}