{
  "country": "MU",
  "city": "port-louis",
  "source": "aladhan",
  "method": "mwl",
  "madhab": "shafi",
  "year": 2026,
  "month": 3,
  "timezone": "Indian/Mauritius",
  "coordinates": {
    "lat": -20.1609,
    "lon": 57.5012
  },
  "days": [
    {
      "date": "2026-03-01",
      "fajr": "04:53",
      "sunrise": "06:08",
      "dhuhr": "12:22",
      "asr": "15:46",
      "maghrib": "18:37",
      "isha": "19:52"
    },
    {
      "date": "2026-03-02",
      "fajr": "04:53",
      "sunrise": "06:08",
      "dhuhr": "12:22",
      "asr": "15:46",
      "maghrib": "18:36",
      "isha": "19:51"
    },
    {
      "date": "2026-03-03",
      "fajr": "04:54",
      "sunrise": "06:08",
      "dhuhr": "12:22",
      "asr": "15:46",
      "maghrib": "18:35",
      "isha": "19:50"
    },
    {
      "date": "2026-03-04",
      "fajr": "04:54",
      "sunrise": "06:09",
      "dhuhr": "12:22",
      "asr": "15:46",
      "maghrib": "18:35",
      "isha": "19:49"
    },
    {
      "date": "2026-03-05",
      "fajr": "04:55",
      "sunrise": "06:09",
      "dhuhr": "12:22",
      "asr": "15:46",
      "maghrib": "18:34",
      "isha": "19:48"
    },
    {
      "date": "2026-03-06",
      "fajr": "04:55",
      "sunrise": "06:09",
      "dhuhr": "12:21",
      "asr": "15:46",
      "maghrib": "18:33",
      "isha": "19:47"
    },
    {
      "date": "2026-03-07",
      "fajr": "04:55",
      "sunrise": "06:10",
      "dhuhr": "12:21",
      "asr": "15:46",
      "maghrib": "18:32",
      "isha": "19:46"
    },
    {
      "date": "2026-03-08",
      "fajr": "04:56",
      "sunrise": "06:10",
      "dhuhr": "12:21",
      "asr": "15:46",
      "maghrib": "18:31",
      "isha": "19:45"
    },
    {
      "date": "2026-03-09",
      "fajr": "04:56",
      "sunrise": "06:10",
      "dhuhr": "12:21",
      "asr": "15:45",
      "maghrib": "18:30",
      "isha": "19:44"
    },
    {
      "date": "2026-03-10",
      "fajr": "04:57",
      "sunrise": "06:11",
      "dhuhr": "12:20",
      "asr": "15:45",
      "maghrib": "18:30",
      "isha": "19:43"
    },
    {
      "date": "2026-03-11",
      "fajr": "04:57",
      "sunrise": "06:11",
      "dhuhr": "12:20",
      "asr": "15:45",
      "maghrib": "18:29",
      "isha": "19:43"
    },
    {
      "date": "2026-03-12",
      "fajr": "04:58",
      "sunrise": "06:11",
      "dhuhr": "12:20",
      "asr": "15:45",
      "maghrib": "18:28",
      "isha": "19:42"
    },
    {
      "date": "2026-03-13",
      "fajr": "04:58",
      "sunrise": "06:12",
      "dhuhr": "12:19",
      "asr": "15:45",
      "maghrib": "18:27",
      "isha": "19:41"
    },
    {
      "date": "2026-03-14",
      "fajr": "04:58",
      "sunrise": "06:12",
      "dhuhr": "12:19",
      "asr": "15:44",
      "maghrib": "18:26",
      "isha": "19:40"
    },
    {
      "date": "2026-03-15",
      "fajr": "04:59",
      "sunrise": "06:12",
      "dhuhr": "12:19",
      "asr": "15:44",
      "maghrib": "18:25",
      "isha": "19:39"
    },
    {
      "date": "2026-03-16",
      "fajr": "04:59",
      "sunrise": "06:13",
      "dhuhr": "12:19",
      "asr": "15:44",
      "maghrib": "18:24",
      "isha": "19:38"
    },
    {
      "date": "2026-03-17",
      "fajr": "04:59",
      "sunrise": "06:13",
      "dhuhr": "12:18",
      "asr": "15:43",
      "maghrib": "18:24",
      "isha": "19:37"
    },
    {
      "date": "2026-03-18",
      "fajr": "05:00",
      "sunrise": "06:13",
      "dhuhr": "12:18",
      "asr": "15:43",
      "maghrib": "18:23",
      "isha": "19:36"
    },
    {
      "date": "2026-03-19",
      "fajr": "05:00",
      "sunrise": "06:13",
      "dhuhr": "12:18",
      "asr": "15:43",
      "maghrib": "18:22",
      "isha": "19:35"
    },
    {
      "date": "2026-03-20",
      "fajr": "05:00",
      "sunrise": "06:14",
      "dhuhr": "12:18",
      "asr": "15:42",
      "maghrib": "18:21",
      "isha": "19:34"
    },
    {
      "date": "2026-03-21",
      "fajr": "05:01",
      "sunrise": "06:14",
      "dhuhr": "12:17",
      "asr": "15:42",
      "maghrib": "18:20",
      "isha": "19:33"
    },
    {
      "date": "2026-03-22",
      "fajr": "05:01",
      "sunrise": "06:14",
      "dhuhr": "12:17",
      "asr": "15:42",
      "maghrib": "18:19",
      "isha": "19:33"
    },
    {
      "date": "2026-03-23",
      "fajr": "05:01",
      "sunrise": "06:15",
      "dhuhr": "12:17",
      "asr": "15:41",
      "maghrib": "18:18",
      "isha": "19:32"
    },
    {
      "date": "2026-03-24",
      "fajr": "05:02",
      "sunrise": "06:15",
      "dhuhr": "12:16",
      "asr": "15:41",
      "maghrib": "18:17",
      "isha": "19:31"
    },
    {
      "date": "2026-03-25",
      "fajr": "05:02",
      "sunrise": "06:15",
      "dhuhr": "12:16",
      "asr": "15:40",
      "maghrib": "18:17",
      "isha": "19:30"
    },
    {
      "date": "2026-03-26",
      "fajr": "05:02",
      "sunrise": "06:15",
      "dhuhr": "12:16",
      "asr": "15:40",
      "maghrib": "18:16",
      "isha": "19:29"
    },
    {
      "date": "2026-03-27",
      "fajr": "05:02",
      "sunrise": "06:16",
      "dhuhr": "12:15",
      "asr": "15:40",
      "maghrib": "18:15",
      "isha": "19:28"
    },
    {
      "date": "2026-03-28",
      "fajr": "05:03",
      "sunrise": "06:16",
      "dhuhr": "12:15",
      "asr": "15:39",
      "maghrib": "18:14",
      "isha": "19:27"
    },
    {
      "date": "2026-03-29",
      "fajr": "05:03",
      "sunrise": "06:16",
      "dhuhr": "12:15",
      "asr": "15:39",
      "maghrib": "18:13",
      "isha": "19:26"
    },
    {
      "date": "2026-03-30",
      "fajr": "05:03",
      "sunrise": "06:16",
      "dhuhr": "12:15",
      "asr": "15:38",
      "maghrib": "18:12",
      "isha": "19:25"
    },
    {
      "date": "2026-03-31",
      "fajr": "05:04",
      "sunrise": "06:17",
      "dhuhr": "12:14",
      "asr": "15:38",
      "maghrib": "18:11",
      "isha": "19:25"
    }
  ]
}