{
  "country": "GB",
  "city": "manchester",
  "source": "aladhan",
  "method": "mwl",
  "madhab": "shafi",
  "year": 2026,
  "month": 1,
  "timezone": "Europe/London",
  "coordinates": {
    "lat": 53.4808,
    "lon": -2.2426
  },
  "days": [
    {
      "date": "2026-01-01",
      "fajr": "06:14",
      "sunrise": "08:25",
      "dhuhr": "12:13",
      "asr": "13:44",
      "maghrib": "16:00",
      "isha": "18:11"
    },
    {
      "date": "2026-01-02",
      "fajr": "06:14",
      "sunrise": "08:25",
      "dhuhr": "12:13",
      "asr": "13:45",
      "maghrib": "16:02",
      "isha": "18:12"
    },
    {
      "date": "2026-01-03",
      "fajr": "06:14",
      "sunrise": "08:25",
      "dhuhr": "12:13",
      "asr": "13:46",
      "maghrib": "16:03",
      "isha": "18:13"
    },
    {
      "date": "2026-01-04",
      "fajr": "06:14",
      "sunrise": "08:24",
      "dhuhr": "12:14",
      "asr": "13:46",
      "maghrib": "16:04",
      "isha": "18:14"
    },
    {
      "date": "2026-01-05",
      "fajr": "06:14",
      "sunrise": "08:24",
      "dhuhr": "12:14",
      "asr": "13:47",
      "maghrib": "16:05",
      "isha": "18:15"
    },
    {
      "date": "2026-01-06",
      "fajr": "06:14",
      "sunrise": "08:23",
      "dhuhr": "12:15",
      "asr": "13:49",
      "maghrib": "16:07",
      "isha": "18:16"
    },
    {
      "date": "2026-01-07",
      "fajr": "06:14",
      "sunrise": "08:23",
      "dhuhr": "12:15",
      "asr": "13:50",
      "maghrib": "16:08",
      "isha": "18:17"
    },
    {
      "date": "2026-01-08",
      "fajr": "06:14",
      "sunrise": "08:22",
      "dhuhr": "12:16",
      "asr": "13:51",
      "maghrib": "16:09",
      "isha": "18:18"
    },
    {
      "date": "2026-01-09",
      "fajr": "06:13",
      "sunrise": "08:22",
      "dhuhr": "12:16",
      "asr": "13:52",
      "maghrib": "16:11",
      "isha": "18:19"
    },
    {
      "date": "2026-01-10",
      "fajr": "06:13",
      "sunrise": "08:21",
      "dhuhr": "12:16",
      "asr": "13:53",
      "maghrib": "16:12",
      "isha": "18:21"
    },
    {
      "date": "2026-01-11",
      "fajr": "06:12",
      "sunrise": "08:20",
      "dhuhr": "12:17",
      "asr": "13:54",
      "maghrib": "16:14",
      "isha": "18:22"
    },
    {
      "date": "2026-01-12",
      "fajr": "06:12",
      "sunrise": "08:20",
      "dhuhr": "12:17",
      "asr": "13:55",
      "maghrib": "16:16",
      "isha": "18:23"
    },
    {
      "date": "2026-01-13",
      "fajr": "06:11",
      "sunrise": "08:19",
      "dhuhr": "12:18",
      "asr": "13:57",
      "maghrib": "16:17",
      "isha": "18:24"
    },
    {
      "date": "2026-01-14",
      "fajr": "06:11",
      "sunrise": "08:18",
      "dhuhr": "12:18",
      "asr": "13:58",
      "maghrib": "16:19",
      "isha": "18:26"
    },
    {
      "date": "2026-01-15",
      "fajr": "06:10",
      "sunrise": "08:17",
      "dhuhr": "12:18",
      "asr": "13:59",
      "maghrib": "16:20",
      "isha": "18:27"
    },
    {
      "date": "2026-01-16",
      "fajr": "06:10",
      "sunrise": "08:16",
      "dhuhr": "12:19",
      "asr": "14:01",
      "maghrib": "16:22",
      "isha": "18:28"
    },
    {
      "date": "2026-01-17",
      "fajr": "06:09",
      "sunrise": "08:15",
      "dhuhr": "12:19",
      "asr": "14:02",
      "maghrib": "16:24",
      "isha": "18:30"
    },
    {
      "date": "2026-01-18",
      "fajr": "06:08",
      "sunrise": "08:14",
      "dhuhr": "12:19",
      "asr": "14:03",
      "maghrib": "16:26",
      "isha": "18:31"
    },
    {
      "date": "2026-01-19",
      "fajr": "06:07",
      "sunrise": "08:13",
      "dhuhr": "12:20",
      "asr": "14:05",
      "maghrib": "16:27",
      "isha": "18:33"
    },
    {
      "date": "2026-01-20",
      "fajr": "06:07",
      "sunrise": "08:12",
      "dhuhr": "12:20",
      "asr": "14:06",
      "maghrib": "16:29",
      "isha": "18:34"
    },
    {
      "date": "2026-01-21",
      "fajr": "06:06",
      "sunrise": "08:10",
      "dhuhr": "12:20",
      "asr": "14:08",
      "maghrib": "16:31",
      "isha": "18:36"
    },
    {
      "date": "2026-01-22",
      "fajr": "06:05",
      "sunrise": "08:09",
      "dhuhr": "12:21",
      "asr": "14:09",
      "maghrib": "16:33",
      "isha": "18:37"
    },
    {
      "date": "2026-01-23",
      "fajr": "06:04",
      "sunrise": "08:08",
      "dhuhr": "12:21",
      "asr": "14:11",
      "maghrib": "16:35",
      "isha": "18:39"
    },
    {
      "date": "2026-01-24",
      "fajr": "06:03",
      "sunrise": "08:06",
      "dhuhr": "12:21",
      "asr": "14:12",
      "maghrib": "16:36",
      "isha": "18:40"
    },
    {
      "date": "2026-01-25",
      "fajr": "06:02",
      "sunrise": "08:05",
      "dhuhr": "12:21",
      "asr": "14:14",
      "maghrib": "16:38",
      "isha": "18:42"
    },
    {
      "date": "2026-01-26",
      "fajr": "06:01",
      "sunrise": "08:04",
      "dhuhr": "12:21",
      "asr": "14:15",
      "maghrib": "16:40",
      "isha": "18:43"
    },
    {
      "date": "2026-01-27",
      "fajr": "05:59",
      "sunrise": "08:02",
      "dhuhr": "12:22",
      "asr": "14:17",
      "maghrib": "16:42",
      "isha": "18:45"
    },
    {
      "date": "2026-01-28",
      "fajr": "05:58",
      "sunrise": "08:01",
      "dhuhr": "12:22",
      "asr": "14:18",
      "maghrib": "16:44",
      "isha": "18:46"
    },
    {
      "date": "2026-01-29",
      "fajr": "05:57",
      "sunrise": "07:59",
      "dhuhr": "12:22",
      "asr": "14:20",
      "maghrib": "16:46",
      "isha": "18:48"
    },
    {
      "date": "2026-01-30",
      "fajr": "05:56",
      "sunrise": "07:57",
      "dhuhr": "12:22",
      "asr": "14:21",
      "maghrib": "16:48",
      "isha": "18:50"
    },
    {
      "date": "2026-01-31",
      "fajr": "05:54",
      "sunrise": "07:56",
      "dhuhr": "12:22",
      "asr": "14:23",
      "maghrib": "16:50",
      "isha": "18:51"
    }
  ]
}