{
  "country": "BE",
  "city": "brussels",
  "source": "aladhan",
  "method": "mwl",
  "madhab": "shafi",
  "year": 2026,
  "month": 2,
  "timezone": "Europe/Brussels",
  "coordinates": {
    "lat": 50.8503,
    "lon": 4.3517
  },
  "days": [
    {
      "date": "2026-02-01",
      "fajr": "06:25",
      "sunrise": "08:19",
      "dhuhr": "12:56",
      "asr": "15:08",
      "maghrib": "17:34",
      "isha": "19:28"
    },
    {
      "date": "2026-02-02",
      "fajr": "06:24",
      "sunrise": "08:17",
      "dhuhr": "12:56",
      "asr": "15:09",
      "maghrib": "17:36",
      "isha": "19:29"
    },
    {
      "date": "2026-02-03",
      "fajr": "06:23",
      "sunrise": "08:16",
      "dhuhr": "12:56",
      "asr": "15:10",
      "maghrib": "17:38",
      "isha": "19:31"
    },
    {
      "date": "2026-02-04",
      "fajr": "06:21",
      "sunrise": "08:14",
      "dhuhr": "12:56",
      "asr": "15:12",
      "maghrib": "17:39",
      "isha": "19:32"
    },
    {
      "date": "2026-02-05",
      "fajr": "06:20",
      "sunrise": "08:13",
      "dhuhr": "12:57",
      "asr": "15:13",
      "maghrib": "17:41",
      "isha": "19:34"
    },
    {
      "date": "2026-02-06",
      "fajr": "06:19",
      "sunrise": "08:11",
      "dhuhr": "12:57",
      "asr": "15:15",
      "maghrib": "17:43",
      "isha": "19:35"
    },
    {
      "date": "2026-02-07",
      "fajr": "06:17",
      "sunrise": "08:09",
      "dhuhr": "12:57",
      "asr": "15:16",
      "maghrib": "17:45",
      "isha": "19:37"
    },
    {
      "date": "2026-02-08",
      "fajr": "06:16",
      "sunrise": "08:08",
      "dhuhr": "12:57",
      "asr": "15:18",
      "maghrib": "17:47",
      "isha": "19:39"
    },
    {
      "date": "2026-02-09",
      "fajr": "06:14",
      "sunrise": "08:06",
      "dhuhr": "12:57",
      "asr": "15:19",
      "maghrib": "17:48",
      "isha": "19:40"
    },
    {
      "date": "2026-02-10",
      "fajr": "06:13",
      "sunrise": "08:04",
      "dhuhr": "12:57",
      "asr": "15:20",
      "maghrib": "17:50",
      "isha": "19:42"
    },
    {
      "date": "2026-02-11",
      "fajr": "06:11",
      "sunrise": "08:02",
      "dhuhr": "12:57",
      "asr": "15:22",
      "maghrib": "17:52",
      "isha": "19:43"
    },
    {
      "date": "2026-02-12",
      "fajr": "06:10",
      "sunrise": "08:01",
      "dhuhr": "12:57",
      "asr": "15:23",
      "maghrib": "17:54",
      "isha": "19:45"
    },
    {
      "date": "2026-02-13",
      "fajr": "06:08",
      "sunrise": "07:59",
      "dhuhr": "12:57",
      "asr": "15:25",
      "maghrib": "17:56",
      "isha": "19:46"
    },
    {
      "date": "2026-02-14",
      "fajr": "06:06",
      "sunrise": "07:57",
      "dhuhr": "12:57",
      "asr": "15:26",
      "maghrib": "17:57",
      "isha": "19:48"
    },
    {
      "date": "2026-02-15",
      "fajr": "06:05",
      "sunrise": "07:55",
      "dhuhr": "12:57",
      "asr": "15:27",
      "maghrib": "17:59",
      "isha": "19:50"
    },
    {
      "date": "2026-02-16",
      "fajr": "06:03",
      "sunrise": "07:53",
      "dhuhr": "12:57",
      "asr": "15:29",
      "maghrib": "18:01",
      "isha": "19:51"
    },
    {
      "date": "2026-02-17",
      "fajr": "06:01",
      "sunrise": "07:51",
      "dhuhr": "12:57",
      "asr": "15:30",
      "maghrib": "18:03",
      "isha": "19:53"
    },
    {
      "date": "2026-02-18",
      "fajr": "05:59",
      "sunrise": "07:49",
      "dhuhr": "12:56",
      "asr": "15:31",
      "maghrib": "18:04",
      "isha": "19:55"
    },
    {
      "date": "2026-02-19",
      "fajr": "05:58",
      "sunrise": "07:48",
      "dhuhr": "12:56",
      "asr": "15:33",
      "maghrib": "18:06",
      "isha": "19:56"
    },
    {
      "date": "2026-02-20",
      "fajr": "05:56",
      "sunrise": "07:46",
      "dhuhr": "12:56",
      "asr": "15:34",
      "maghrib": "18:08",
      "isha": "19:58"
    },
    {
      "date": "2026-02-21",
      "fajr": "05:54",
      "sunrise": "07:44",
      "dhuhr": "12:56",
      "asr": "15:35",
      "maghrib": "18:10",
      "isha": "19:59"
    },
    {
      "date": "2026-02-22",
      "fajr": "05:52",
      "sunrise": "07:42",
      "dhuhr": "12:56",
      "asr": "15:37",
      "maghrib": "18:11",
      "isha": "20:01"
    },
    {
      "date": "2026-02-23",
      "fajr": "05:50",
      "sunrise": "07:40",
      "dhuhr": "12:56",
      "asr": "15:38",
      "maghrib": "18:13",
      "isha": "20:03"
    },
    {
      "date": "2026-02-24",
      "fajr": "05:48",
      "sunrise": "07:38",
      "dhuhr": "12:56",
      "asr": "15:39",
      "maghrib": "18:15",
      "isha": "20:05"
    },
    {
      "date": "2026-02-25",
      "fajr": "05:46",
      "sunrise": "07:35",
      "dhuhr": "12:56",
      "asr": "15:41",
      "maghrib": "18:17",
      "isha": "20:06"
    },
    {
      "date": "2026-02-26",
      "fajr": "05:44",
      "sunrise": "07:33",
      "dhuhr": "12:55",
      "asr": "15:42",
      "maghrib": "18:18",
      "isha": "20:08"
    },
    {
      "date": "2026-02-27",
      "fajr": "05:42",
      "sunrise": "07:31",
      "dhuhr": "12:55",
      "asr": "15:43",
      "maghrib": "18:20",
      "isha": "20:10"
    },
    {
      "date": "2026-02-28",
      "fajr": "05:40",
      "sunrise": "07:29",
      "dhuhr": "12:55",
      "asr": "15:45",
      "maghrib": "18:22",
      "isha": "20:11"
    }
  ]
}