{
  "country": "LB",
  "city": "tripoli",
  "source": "aladhan",
  "method": "egypt",
  "madhab": "shafi",
  "year": 2026,
  "month": 11,
  "timezone": "Asia/Beirut",
  "coordinates": {
    "lat": 34.4367,
    "lon": 35.8497
  },
  "days": [
    {
      "date": "2026-11-01",
      "fajr": "04:31",
      "sunrise": "05:57",
      "dhuhr": "11:20",
      "asr": "14:21",
      "maghrib": "16:43",
      "isha": "18:04"
    },
    {
      "date": "2026-11-02",
      "fajr": "04:32",
      "sunrise": "05:57",
      "dhuhr": "11:20",
      "asr": "14:21",
      "maghrib": "16:42",
      "isha": "18:03"
    },
    {
      "date": "2026-11-03",
      "fajr": "04:33",
      "sunrise": "05:58",
      "dhuhr": "11:20",
      "asr": "14:20",
      "maghrib": "16:41",
      "isha": "18:02"
    },
    {
      "date": "2026-11-04",
      "fajr": "04:34",
      "sunrise": "05:59",
      "dhuhr": "11:20",
      "asr": "14:19",
      "maghrib": "16:41",
      "isha": "18:01"
    },
    {
      "date": "2026-11-05",
      "fajr": "04:35",
      "sunrise": "06:00",
      "dhuhr": "11:20",
      "asr": "14:19",
      "maghrib": "16:40",
      "isha": "18:00"
    },
    {
      "date": "2026-11-06",
      "fajr": "04:36",
      "sunrise": "06:01",
      "dhuhr": "11:20",
      "asr": "14:18",
      "maghrib": "16:39",
      "isha": "18:00"
    },
    {
      "date": "2026-11-07",
      "fajr": "04:36",
      "sunrise": "06:02",
      "dhuhr": "11:20",
      "asr": "14:17",
      "maghrib": "16:38",
      "isha": "17:59"
    },
    {
      "date": "2026-11-08",
      "fajr": "04:37",
      "sunrise": "06:03",
      "dhuhr": "11:20",
      "asr": "14:17",
      "maghrib": "16:37",
      "isha": "17:58"
    },
    {
      "date": "2026-11-09",
      "fajr": "04:38",
      "sunrise": "06:04",
      "dhuhr": "11:20",
      "asr": "14:16",
      "maghrib": "16:36",
      "isha": "17:58"
    },
    {
      "date": "2026-11-10",
      "fajr": "04:39",
      "sunrise": "06:05",
      "dhuhr": "11:20",
      "asr": "14:15",
      "maghrib": "16:36",
      "isha": "17:57"
    },
    {
      "date": "2026-11-11",
      "fajr": "04:40",
      "sunrise": "06:06",
      "dhuhr": "11:21",
      "asr": "14:15",
      "maghrib": "16:35",
      "isha": "17:56"
    },
    {
      "date": "2026-11-12",
      "fajr": "04:40",
      "sunrise": "06:07",
      "dhuhr": "11:21",
      "asr": "14:14",
      "maghrib": "16:34",
      "isha": "17:56"
    },
    {
      "date": "2026-11-13",
      "fajr": "04:41",
      "sunrise": "06:08",
      "dhuhr": "11:21",
      "asr": "14:14",
      "maghrib": "16:34",
      "isha": "17:55"
    },
    {
      "date": "2026-11-14",
      "fajr": "04:42",
      "sunrise": "06:09",
      "dhuhr": "11:21",
      "asr": "14:13",
      "maghrib": "16:33",
      "isha": "17:55"
    },
    {
      "date": "2026-11-15",
      "fajr": "04:43",
      "sunrise": "06:10",
      "dhuhr": "11:21",
      "asr": "14:13",
      "maghrib": "16:32",
      "isha": "17:54"
    },
    {
      "date": "2026-11-16",
      "fajr": "04:44",
      "sunrise": "06:11",
      "dhuhr": "11:21",
      "asr": "14:12",
      "maghrib": "16:32",
      "isha": "17:54"
    },
    {
      "date": "2026-11-17",
      "fajr": "04:44",
      "sunrise": "06:12",
      "dhuhr": "11:22",
      "asr": "14:12",
      "maghrib": "16:31",
      "isha": "17:53"
    },
    {
      "date": "2026-11-18",
      "fajr": "04:45",
      "sunrise": "06:13",
      "dhuhr": "11:22",
      "asr": "14:11",
      "maghrib": "16:31",
      "isha": "17:53"
    },
    {
      "date": "2026-11-19",
      "fajr": "04:46",
      "sunrise": "06:14",
      "dhuhr": "11:22",
      "asr": "14:11",
      "maghrib": "16:30",
      "isha": "17:52"
    },
    {
      "date": "2026-11-20",
      "fajr": "04:47",
      "sunrise": "06:14",
      "dhuhr": "11:22",
      "asr": "14:11",
      "maghrib": "16:30",
      "isha": "17:52"
    },
    {
      "date": "2026-11-21",
      "fajr": "04:48",
      "sunrise": "06:15",
      "dhuhr": "11:22",
      "asr": "14:10",
      "maghrib": "16:29",
      "isha": "17:52"
    },
    {
      "date": "2026-11-22",
      "fajr": "04:49",
      "sunrise": "06:16",
      "dhuhr": "11:23",
      "asr": "14:10",
      "maghrib": "16:29",
      "isha": "17:52"
    },
    {
      "date": "2026-11-23",
      "fajr": "04:49",
      "sunrise": "06:17",
      "dhuhr": "11:23",
      "asr": "14:10",
      "maghrib": "16:28",
      "isha": "17:51"
    },
    {
      "date": "2026-11-24",
      "fajr": "04:50",
      "sunrise": "06:18",
      "dhuhr": "11:23",
      "asr": "14:09",
      "maghrib": "16:28",
      "isha": "17:51"
    },
    {
      "date": "2026-11-25",
      "fajr": "04:51",
      "sunrise": "06:19",
      "dhuhr": "11:24",
      "asr": "14:09",
      "maghrib": "16:28",
      "isha": "17:51"
    },
    {
      "date": "2026-11-26",
      "fajr": "04:52",
      "sunrise": "06:20",
      "dhuhr": "11:24",
      "asr": "14:09",
      "maghrib": "16:27",
      "isha": "17:51"
    },
    {
      "date": "2026-11-27",
      "fajr": "04:53",
      "sunrise": "06:21",
      "dhuhr": "11:24",
      "asr": "14:09",
      "maghrib": "16:27",
      "isha": "17:51"
    },
    {
      "date": "2026-11-28",
      "fajr": "04:53",
      "sunrise": "06:22",
      "dhuhr": "11:25",
      "asr": "14:09",
      "maghrib": "16:27",
      "isha": "17:50"
    },
    {
      "date": "2026-11-29",
      "fajr": "04:54",
      "sunrise": "06:23",
      "dhuhr": "11:25",
      "asr": "14:08",
      "maghrib": "16:27",
      "isha": "17:50"
    },
    {
      "date": "2026-11-30",
      "fajr": "04:55",
      "sunrise": "06:24",
      "dhuhr": "11:25",
      "asr": "14:08",
      "maghrib": "16:26",
      "isha": "17:50"
    }
  ]
}