{
  "country": "IR",
  "city": "isfahan",
  "source": "aladhan",
  "method": "tehran",
  "madhab": "shafi",
  "year": 2026,
  "month": 3,
  "timezone": "Asia/Tehran",
  "coordinates": {
    "lat": 32.6539,
    "lon": 51.666
  },
  "days": [
    {
      "date": "2026-03-01",
      "fajr": "05:11",
      "sunrise": "06:31",
      "dhuhr": "12:16",
      "asr": "15:31",
      "maghrib": "18:18",
      "isha": "19:03"
    },
    {
      "date": "2026-03-02",
      "fajr": "05:10",
      "sunrise": "06:30",
      "dhuhr": "12:15",
      "asr": "15:31",
      "maghrib": "18:19",
      "isha": "19:04"
    },
    {
      "date": "2026-03-03",
      "fajr": "05:09",
      "sunrise": "06:29",
      "dhuhr": "12:15",
      "asr": "15:32",
      "maghrib": "18:20",
      "isha": "19:05"
    },
    {
      "date": "2026-03-04",
      "fajr": "05:08",
      "sunrise": "06:28",
      "dhuhr": "12:15",
      "asr": "15:32",
      "maghrib": "18:20",
      "isha": "19:05"
    },
    {
      "date": "2026-03-05",
      "fajr": "05:06",
      "sunrise": "06:27",
      "dhuhr": "12:15",
      "asr": "15:33",
      "maghrib": "18:21",
      "isha": "19:06"
    },
    {
      "date": "2026-03-06",
      "fajr": "05:05",
      "sunrise": "06:25",
      "dhuhr": "12:15",
      "asr": "15:33",
      "maghrib": "18:22",
      "isha": "19:07"
    },
    {
      "date": "2026-03-07",
      "fajr": "05:04",
      "sunrise": "06:24",
      "dhuhr": "12:14",
      "asr": "15:33",
      "maghrib": "18:23",
      "isha": "19:08"
    },
    {
      "date": "2026-03-08",
      "fajr": "05:03",
      "sunrise": "06:23",
      "dhuhr": "12:14",
      "asr": "15:34",
      "maghrib": "18:23",
      "isha": "19:09"
    },
    {
      "date": "2026-03-09",
      "fajr": "05:01",
      "sunrise": "06:22",
      "dhuhr": "12:14",
      "asr": "15:34",
      "maghrib": "18:24",
      "isha": "19:09"
    },
    {
      "date": "2026-03-10",
      "fajr": "05:00",
      "sunrise": "06:20",
      "dhuhr": "12:14",
      "asr": "15:34",
      "maghrib": "18:25",
      "isha": "19:10"
    },
    {
      "date": "2026-03-11",
      "fajr": "04:59",
      "sunrise": "06:19",
      "dhuhr": "12:13",
      "asr": "15:35",
      "maghrib": "18:26",
      "isha": "19:11"
    },
    {
      "date": "2026-03-12",
      "fajr": "04:58",
      "sunrise": "06:18",
      "dhuhr": "12:13",
      "asr": "15:35",
      "maghrib": "18:26",
      "isha": "19:12"
    },
    {
      "date": "2026-03-13",
      "fajr": "04:56",
      "sunrise": "06:17",
      "dhuhr": "12:13",
      "asr": "15:35",
      "maghrib": "18:27",
      "isha": "19:12"
    },
    {
      "date": "2026-03-14",
      "fajr": "04:55",
      "sunrise": "06:15",
      "dhuhr": "12:13",
      "asr": "15:36",
      "maghrib": "18:28",
      "isha": "19:13"
    },
    {
      "date": "2026-03-15",
      "fajr": "04:54",
      "sunrise": "06:14",
      "dhuhr": "12:12",
      "asr": "15:36",
      "maghrib": "18:29",
      "isha": "19:14"
    },
    {
      "date": "2026-03-16",
      "fajr": "04:52",
      "sunrise": "06:13",
      "dhuhr": "12:12",
      "asr": "15:36",
      "maghrib": "18:29",
      "isha": "19:15"
    },
    {
      "date": "2026-03-17",
      "fajr": "04:51",
      "sunrise": "06:11",
      "dhuhr": "12:12",
      "asr": "15:36",
      "maghrib": "18:30",
      "isha": "19:15"
    },
    {
      "date": "2026-03-18",
      "fajr": "04:50",
      "sunrise": "06:10",
      "dhuhr": "12:11",
      "asr": "15:37",
      "maghrib": "18:31",
      "isha": "19:16"
    },
    {
      "date": "2026-03-19",
      "fajr": "04:48",
      "sunrise": "06:09",
      "dhuhr": "12:11",
      "asr": "15:37",
      "maghrib": "18:31",
      "isha": "19:17"
    },
    {
      "date": "2026-03-20",
      "fajr": "04:47",
      "sunrise": "06:07",
      "dhuhr": "12:11",
      "asr": "15:37",
      "maghrib": "18:32",
      "isha": "19:18"
    },
    {
      "date": "2026-03-21",
      "fajr": "04:45",
      "sunrise": "06:06",
      "dhuhr": "12:11",
      "asr": "15:37",
      "maghrib": "18:33",
      "isha": "19:18"
    },
    {
      "date": "2026-03-22",
      "fajr": "04:44",
      "sunrise": "06:05",
      "dhuhr": "12:10",
      "asr": "15:38",
      "maghrib": "18:34",
      "isha": "19:19"
    },
    {
      "date": "2026-03-23",
      "fajr": "04:43",
      "sunrise": "06:04",
      "dhuhr": "12:10",
      "asr": "15:38",
      "maghrib": "18:34",
      "isha": "19:20"
    },
    {
      "date": "2026-03-24",
      "fajr": "04:41",
      "sunrise": "06:02",
      "dhuhr": "12:10",
      "asr": "15:38",
      "maghrib": "18:35",
      "isha": "19:21"
    },
    {
      "date": "2026-03-25",
      "fajr": "04:40",
      "sunrise": "06:01",
      "dhuhr": "12:09",
      "asr": "15:38",
      "maghrib": "18:36",
      "isha": "19:21"
    },
    {
      "date": "2026-03-26",
      "fajr": "04:38",
      "sunrise": "06:00",
      "dhuhr": "12:09",
      "asr": "15:38",
      "maghrib": "18:36",
      "isha": "19:22"
    },
    {
      "date": "2026-03-27",
      "fajr": "04:37",
      "sunrise": "05:58",
      "dhuhr": "12:09",
      "asr": "15:38",
      "maghrib": "18:37",
      "isha": "19:23"
    },
    {
      "date": "2026-03-28",
      "fajr": "04:36",
      "sunrise": "05:57",
      "dhuhr": "12:08",
      "asr": "15:39",
      "maghrib": "18:38",
      "isha": "19:24"
    },
    {
      "date": "2026-03-29",
      "fajr": "04:34",
      "sunrise": "05:56",
      "dhuhr": "12:08",
      "asr": "15:39",
      "maghrib": "18:39",
      "isha": "19:25"
    },
    {
      "date": "2026-03-30",
      "fajr": "04:33",
      "sunrise": "05:54",
      "dhuhr": "12:08",
      "asr": "15:39",
      "maghrib": "18:39",
      "isha": "19:25"
    },
    {
      "date": "2026-03-31",
      "fajr": "04:31",
      "sunrise": "05:53",
      "dhuhr": "12:08",
      "asr": "15:39",
      "maghrib": "18:40",
      "isha": "19:26"
    }
  ]
}